tweet_id,timestamp_1,likes,retweets,replies,polarity,subjectivity,clean_text
1236803147043155968,2020-03-08 23:57:03,3,0,0,-0.0417,0.1583,"It is heartening to read this. #coronavirus knows no borders, no races, does not distinguish political systems, democratic or not. We are all together as a global community. Lets support each other. "
1236803145713451021,2020-03-08 23:57:03,0,0,0,0.0,0.0,Lawmaker Reveals Pelosi Tripled Coronavirus Bill Cost with 'Christmas-Tree Ornaments' 
1236803145629495296,2020-03-08 23:57:03,0,1,0,-0.7,1.0,The Tell: Coronavirus and OPEC-vs.-Russia oil price war could take crude into the $20s: Goldman Sachs  #stock #trendspic.twitter.com/IxwPUB8wao
1236803143771488263,2020-03-08 23:57:02,5,1,1,0.0,0.0,Sen. Ted Cruz to undergo self-quarantine after coming into contact with #coronavirus patient 
1236803143771418624,2020-03-08 23:57:02,12,2,0,0.0,0.0,corona virus hit riverside and coachella is in riverside county ! UM SIR pic.twitter.com/MXswvJjPQ8
1236803143624622080,2020-03-08 23:57:02,0,0,0,0.0,0.0,  Apple reduces capacity at store events to deal with coronavirus outbreak 
1236803143356145664,2020-03-08 23:57:02,2,0,0,0.0,0.0,Being a travel agent during the coronavirus outbreak has me not vibing
1236803142538452999,2020-03-08 23:57:02,0,0,0,0.25,0.5,"We are selling surgical masks and contactless thermometers, anyone interested to buy DM me!#Masks #coronavirus "
1236803142102028288,2020-03-08 23:57:02,0,0,0,0.0,0.0,Minneapolis News Churches in Minnesota change worship services because of coronavirus outbreak 
1236803140856487937,2020-03-08 23:57:02,5,0,2,0.0,0.0,#coronavirus prevention. Let's bump elbows/forearms instead 
1236803138872438784,2020-03-08 23:57:01,0,0,0,0.3333,0.5,"Given that Trump doesn’t listen, doesn’t learn, and obviously knows nothing about the Coronavirus, America is better off when he’s golfing. Shove a camera in front of him, and he’ll just spew more misinformation."
1236803138537086981,2020-03-08 23:57:01,8,4,1,-0.1,0.1,NY AG hits Jim Bakker with cease-and-desist order over alleged coronavirus cure -  News
1236803137798897665,2020-03-08 23:57:01,0,0,0,0.0,0.0,Lmaoooo they gotta have coronavirus or something. Their brains are warped
1236803137132007424,2020-03-08 23:57:01,1,1,0,0.0682,0.3,"Question of the day: Will coronavirus actually change how we live?

By  for  »"
1236803136662183938,2020-03-08 23:57:01,0,0,0,0.3333,0.4583,"But  isn’t worried. Unless the virus is gay, in which case he will be all over it. Literally. #CoronavirusOutbreak If coronavirus occurred in women or the uterus we’d have had a law controlling it on the first day."
1236803136070787073,2020-03-08 23:57:00,0,0,0,0.225,0.45,"Can't decide if I dislike people downplaying coronavirus because it isn't deadly for healthy young people, or people fearmongering about it for clicks it more."
1236803135365992448,2020-03-08 23:57:00,0,0,0,-0.1875,0.4,This shits been happening for as long as I’m been alive.  No need to bring this crap back now you’ve been replaced on stage by Corona Virus.
1236803134137282562,2020-03-08 23:57:00,0,0,0,0.1364,0.5,#Coronavirus live updates: #TedCruz shook hands with CPAC patient; State Department warns against cruise travel
1236803134019772420,2020-03-08 23:57:00,0,0,0,0.0,0.0,Almost as if we needed the coronavirus to stop nonsensical consumerism/pollution.... almost.
1236803133570940929,2020-03-08 23:57:00,0,0,0,0.1705,0.4545,"That's a new one !
Blame Brexit for the Corona virus ?"
1236803133210271745,2020-03-08 23:57:00,0,0,0,0.0,0.0,"""It's Not All Under Control"": While Government Says Health System Is ""Well-Prepared"" For Coronavirus, Hospitals Are Saying Otherwise "
1236803132799188993,2020-03-08 23:57:00,0,2,0,0.125,0.5667,"#Coronavirus on the Nile : #Egypt's first Coronavirus death, queues for PCR Certificates and patient in critical condition  #COVID19 #Mideast #Africa"
1236803132765753346,2020-03-08 23:57:00,0,0,0,0.0682,0.2273,Chinese scientist study finds two types of the new coronavirus strains..... #China #Shanghai #Wuhan #COVID #CoronavirusOutbreak #COVID19 #COVID2019 #CoronavirusChina #Covid_19 #Coronavirus #COVIDー19
1236803132727812096,2020-03-08 23:57:00,0,0,0,0.0,0.0,West Oakland folks got cancerous chemicals in their water system and now a cruise ship with known coronavirus infected people....
1236803131482103813,2020-03-08 23:56:59,7,7,1,0.1,0.15,"The Australian stock market has shed more than $100 billion as it sinks to its lowest level in over a year, following US markets lower after a rise in the number of coronavirus cases. "
1236803131234750464,2020-03-08 23:56:59,2,0,0,0.205,0.495,Finally started watching The Handmaid’s Tale tonight and something tells me a dystopian drama is not the best pick to help me relax in the midst of #coronavirus (how it took me so long to watch it is a whole other matter) #InternationalWomensDay
1236803130341429250,2020-03-08 23:56:59,0,0,0,0.0,0.0,Trump calls Inslee a 'snake' amid coronavirus outbreak in Washington state 
1236803129536118785,2020-03-08 23:56:59,0,0,0,0.1364,0.4545," 83 new cases in France 

#coronavirus #COVID2019 #France #Coronavid19 #CoronavirusOutbreak"
1236803127422132224,2020-03-08 23:56:58,2,0,1,0.0,0.125,"Imagine if we had the same sense of panic and urgency to eradicate #cancer as there is  #coronavirus. ~10 million will die from cancer worldwide this year. Perhaps we are just used to knowing people diagnosed with or dying from cancer. 

"
1236803125245337602,2020-03-08 23:56:58,12,0,4,0.7333,0.9,lmao so there's coronavirus in my city lol they'll probbably close my school and I dont know if I'm extremely happy or terrified pic.twitter.com/I3D2RwUCke
1236803125132103681,2020-03-08 23:56:58,0,0,2,-0.0111,0.0256,3rd stop for toilet paper that we just need for regular purposes. #COVID19 pic.twitter.com/JzRBFlhxaC – at Target
1236803124817346561,2020-03-08 23:56:58,6,4,0,-0.5,0.5,"We should have all been yang gang bc Bernie, Biden, and Trump are all in the vulnerable Coronavirus age group. Those dudes might not make it"
1236803124318388224,2020-03-08 23:56:58,0,0,0,0.2273,0.5455,Rick Scott pleads for transparency as visitor to Palm Beach tests positive for coronavirus  via 
1236803122661429248,2020-03-08 23:56:57,0,0,0,0.0,0.0,Do people sanitize the sanitizer? #COVID2019
1236803120681963520,2020-03-08 23:56:57,3,0,0,0.0,0.0,Get injected with coronavirus to help find a cure. All I hear is paid two weeks holiday with the FF7 remake.
1236803120618848256,2020-03-08 23:56:57,0,0,0,-0.05,0.8,"That's funny, I thought this was a liberal hoax and a fake disease and that it was completely contained and that there were virtually no cases anymore. #COVID19 #MAGA"
1236803120526548992,2020-03-08 23:56:57,0,0,1,0.0,0.0,Trump didn't say the Corona virus is a hoax
1236803119243091968,2020-03-08 23:56:56,0,0,0,0.4281,0.6583,Amazing numbers on this press handout from the nursing home in Washington that experienced one of the first known major outbreaks of Coronavirus in the US. 
1236803116856741894,2020-03-08 23:56:56,0,0,0,0.0625,0.5,‘It is unacceptable’: Man with coronavirus skips self-isolation to go to work at major hotel and visit nightclub 
1236803114478559232,2020-03-08 23:56:55,0,0,0,0.1722,0.6056,"., of the , says, of #COVID19, “This is not just the flu. It’s much more serious than the flu.” My Question: Do we know, definitively, that what Mr. Riley says is true? #FactsNotFear   "
1236803113115439105,2020-03-08 23:56:55,2,0,0,-0.8929,0.8571,"#CureCOVID #COVID19  Country needs   to be a bull in a china shop and get every sick person treated with Remdesivir today.  Stop the delay, stop the deaths!"
1236803112523853824,2020-03-08 23:56:55,670,5,69,-0.5,1.0,THERES A CORONAVIRUS PATIENT AT MY MOMS JOB WTF
1236803112003747840,2020-03-08 23:56:55,0,0,0,0.0,1.0,BREAKING: Trump Reassures That Coronavirus Only Contagious Before it's Contracted pic.twitter.com/6GTMfDnae9
1236803110909005825,2020-03-08 23:56:54,0,0,0,0.0,0.0,U.S. response to the COVID-19 coronavirus moves from “containment” to “mitigation”.
1236803109613166592,2020-03-08 23:56:54,0,0,0,0.5,0.5,Staying safe out here in these #coronavirus infected streets 
1236803109135007744,2020-03-08 23:56:54,0,1,1,0.3333,0.375,We all need to do our part to delay the spread of #COVID19 to give our healthcare system a chance. The US already has one of the highest death rates—How many more deaths will there be if thousands of severe cases show up to our hospitals at the same time? #coronavirus 
1236803108342128640,2020-03-08 23:56:54,0,0,0,0.7,0.9,fair to say not if but when will the recession hit; $120b wiped off ASX within 15mins of opening #coronavirus #ASX
1236803105859272704,2020-03-08 23:56:53,0,0,0,0.3,0.45, Quite a panel you have there Chris. So tell me what direct affect  has with the Corona Virus impact to the economy? None truthfully. #NeverTumpersEverywhere #KAG2020 #Trump2020  /Qm5qkQAV9G
1236803105255088128,2020-03-08 23:56:53,0,0,0,-0.55,0.9,": ""This shit's gettin' real crazy, I'm gonna hide out at home shitposting on Twitter and continue to get paid for a couple weeks."" #COVID19"
1236803103325859840,2020-03-08 23:56:53,3,1,1,0.0,0.0,‘Getting closer to home’: Edmonton seniors have growing concerns over the coronavirus 
1236803102013095942,2020-03-08 23:56:52,1,0,0,0.6333,0.6333,"For the love of God folks,dont ring 999 if you think you've the coronavirus. Contact the HSE helpline! There are genuine people who have loved ones literally dying in front of them. You having a tickley cough & a temp doesnt require you to tie up an emergency phone line! #COVID19"
1236803101656584193,2020-03-08 23:56:52,1,0,2,-0.7,0.6667,Maybe coronavirus will lead to halting eviction enforcement like during the holidays or bad weather...
1236803099961880576,2020-03-08 23:56:52,2,2,0,0.2881,0.5254,Chulalongkorn University has joined forces with Advanced Info Service (AIS) to develop smart robots with 5G tech to monitor and take care of coronavirus patients and those under monitoring for the first time in Thailand. #BangkokPost #Business
1236803099605393408,2020-03-08 23:56:52,1,0,0,0.0,0.1,"Despite the coronavirus epidemic, Berli Jucker Plc (BJC), the trading company and operator of Big C Supercenter, plans to allocate 8-10 billion baht this year as planned to expand business, citing recovering consumer spending power. #BangkokPost #Business"
1236803099517267968,2020-03-08 23:56:52,3,2,0,0.1,0.6,The Revenue Department is likely to cut its tax revenue collection target of 2.12 trillion baht for this fiscal year as the coronavirus outbreak takes its toll on the country's economic growth. #BangkokPost #Business
1236803099299323904,2020-03-08 23:56:52,29,1,0,0.0,0.0,can someone from tulane please take one for the team and get coronavirus so we can have online classes i’m begging
1236803099190157314,2020-03-08 23:56:52,2,0,0,0.0667,0.0667,"Financial markets and economic forecasters are warning of rising risks for the U.S. and global economy, which were improving before the novel coronavirus spread from China around the world. #BangkokPost #Business"
1236803098238042112,2020-03-08 23:56:51,0,0,0,0.2,0.2,What if Donald Trump really does have the coronavirus?  via 
1236803098099822593,2020-03-08 23:56:51,2,0,1,0.1667,0.425,"So if we can’t test to confirm coronavirus, deaths will be attributed to other causes like pneumonia. And most young people will recover. Diabolical but it may well work. I would say if you’re over 60 self isolate!"
1236803097961418754,2020-03-08 23:56:51,2,1,0,0.0083,0.5583,Someone needs to tell the doofus in the WH that there’s a lot of year left. Given the way he’s mismanaged the Coronavirus and it’s potential negative impact on our economy we’ll be lucky to get out of this with any job growth this year. pic.twitter.com/gpif97SiZk
1236803096992288768,2020-03-08 23:56:51,0,0,1,0.1625,0.65,"Far as I understand, it's a far higher number of staff on board than guests that have #COVID19. 

It's a sticky situation. I don't know where liability would or should be, or if there is anybody at all to point fingers at. But everyone wants someone to blame."
1236803096052981761,2020-03-08 23:56:51,0,0,2,0.0,0.0,Don’t they have coronavirus to get
1236803094995816448,2020-03-08 23:56:51,0,0,0,0.5,0.5,"""133 more coronavirus deaths reported as Italy becomes the second-most affected country""  "
1236803094211629056,2020-03-08 23:56:51,0,0,0,0.0,0.0,"Ted cruz.....self quarantine..... corona virus....

If christina hendricks shows up at my door topless, all of my prayers have been answered."
1236803093519466497,2020-03-08 23:56:50,0,0,0,-0.7143,0.8571,Sick in bed. Getting over the Coronavirus symptoms.
1236803093469237249,2020-03-08 23:56:50,0,0,1,0.2857,0.5357,"Yep, right now, trump is trying to officially change the name of Coronavirus to Obamavirus."
1236803092642922498,2020-03-08 23:56:50,0,0,0,0.0,0.0,"Stay off cruise ships and airplanes amid coronavirus outbreak, health official warns high-risk travelers - Fox Business "
1236803092047368192,2020-03-08 23:56:50,1,0,1,0.0,0.0,I’m at the point in my life where I’d prefer to have coronavirus than go to work and socialise
1236803091774742529,2020-03-08 23:56:50,0,0,0,0.0,0.0,Theyre gonna use coronavirus to justify #HidinJoeBiden
1236803089635696641,2020-03-08 23:56:49,1,0,1,0.3133,0.6,"Using Alcohol and U.V Light to Clean Your Smartphones to Be Free of Coronavirus.


Use your FREE daily 50MB data on Opera News"
1236803087693537280,2020-03-08 23:56:49,0,0,0,0.5,0.625,"#Canada #LabBoxes #COVID19 to the countries beyond our borders, we hope your gov’t officials will be able to send out these boxes to their citizens. #America #Iran #Italy #SouthKorea #Europe #China So people can do tests at home"
1236803084656857088,2020-03-08 23:56:48,0,0,0,0.0,0.0,"Beltway Insider: Trump/Corona Virus, Cases Spike, Structure Weakness, Election 2020: Biden, Sanders #.XmWGOn05P2w.twitter …"
1236803083654565893,2020-03-08 23:56:48,0,0,0,0.7812,0.5,"Just one more thing..  I hear washing hands everywhere but no one emphasing to during day time WASH UR FACE TOO GUYS!! u know u touched it. U know 
#coronavirus"
1236803082354294786,2020-03-08 23:56:48,0,0,0,0.0,0.0,Went to the supermarket and there was no hand soap. Did people not wash there hands before the coronavirus scare
1236803082048221185,2020-03-08 23:56:48,1,0,0,0.0,0.0,they are begging for help because of coronavirus..
1236803080148013057,2020-03-08 23:56:47,0,0,0,0.0,0.3333,"My parents have flights to visit us but with the concerns about the #Coronavirus want to push back their flight or cancel. Cos they purchased a #SaverFare prior to 2/27, the ONLY exception #AlaskanAirlines will do is allow us to PAY the $125 fee to receive a credit.  "
1236803076880601088,2020-03-08 23:56:46,0,0,0,-0.0667,0.2583,‘Novel’ Loan May Let Private Equity Firm Add Coronavirus Losses Back to Earnings  
1236803074968125441,2020-03-08 23:56:46,11,0,0,0.3333,1.0,"If I die from Covid-19, please retweet all of my coronavirus tweets and clown them. A worthy adversary deserves his work to be cherished, and his opponent to be taunted."
1236803074703757312,2020-03-08 23:56:46,0,0,0,0.0,0.0,Christian pastor: Coronavirus is here because ‘God destroys LGBT societies’ - 
1236803074326499328,2020-03-08 23:56:46,0,0,0,0.0,0.0,"It means mass fatalities from a mishandled coronavirus epidemic. 
#TrumpVirus"
1236803072824881153,2020-03-08 23:56:45,0,0,0,-0.0317,0.7976,Experts know that people go to work while sick with #COVID19 because they need the income. Having an emergency #BasicIncome program for the duration of the outbreak would make sense and I see no one pushing for that right now. There is no expert in extraordinary events like this.
1236803072724066304,2020-03-08 23:56:45,22,4,3,0.475,0.5667,"Lots of people don't like hugs and now the coronavirus is out more people don't want handshakes or even fist bumps.

I 100% respect this so we developed the foot-tap!  you're welcome 

#foottap #coronavirus #CoronavirusOutbreak #Coronavid19pic.twitter.com/7yB4yJlHNT"
1236803071474307072,2020-03-08 23:56:45,0,0,0,0.0,0.0,I posted this in 2016...it is happening. Trump knows how to turn roadblocks into opportunity. Just watch....The Corona Virus is going to accelerate bring Manufacturing Back to America. FOR A TRUMP 2020 LANDSLIDE. pic.twitter.com/yBycO4MAVM
1236803071126040576,2020-03-08 23:56:45,1,2,0,-0.0907,0.2852,"If the price goes down to $30 or even less, the Canadian economy will take a hit just from this alone. 
Then add impact from the Coronavirus on the economy in general."
1236803070933135360,2020-03-08 23:56:45,1,0,1,0.0,0.0,Isn't NY in quarantine because of the coronavirus?
1236803070677471233,2020-03-08 23:56:45,0,0,0,0.0,0.0,"Another North Korean with Coronavirus, gone."
1236803070522245125,2020-03-08 23:56:45,0,0,2,0.0,0.0,If Trump get Corona Virus?
1236803070190858241,2020-03-08 23:56:45,0,0,0,0.0,0.0,Waiting for Jared and Ivanka to announce they will be housing coronavirus victims in Jared's vacant apartment buildings...............at $650 per night. That's the studio apartment rate. 
1236803068857061377,2020-03-08 23:56:44,0,0,0,-0.2,0.6,Coronavirus outbreak disrupts everyday life in Italy |  
1236803067552677896,2020-03-08 23:56:44,0,0,1,0.0,0.0,I bet JamzLDN is immune to the coronavirus virus
1236803067531554817,2020-03-08 23:56:44,2,0,0,0.1078,0.5822,"#Italy  is the first ""democratic country"" to lock down its own people over the #COVID2019 #COVID19 #COVID2019 #coronavirus.  Only can hope the warmer weather slows it down. #italylockdown "
1236803065589534720,2020-03-08 23:56:44,26,0,2,0.5,0.5,It appears that Costco is doing more to stop the spread of coronavirus than the entirety of the federal government.
1236803064473907200,2020-03-08 23:56:43,0,0,0,0.2167,0.675,"Coronavirus symptoms: The progression from moderate to severe can occur ‘very, very quickly’ "
1236803063991750657,2020-03-08 23:56:43,0,0,0,-0.0269,0.288," 
Dow futures down 900 points.  What the hell are you going to do to turn the markets around?  Let's see just how much of a genius you are.    

Ted Cruz in self quarantine due to #COVID19 .  Did someone say #Hoax ?  #FakeNews ?"
1236803062616002561,2020-03-08 23:56:43,0,0,0,0.0,0.0,Pope Francis livestreams Sunday address amid coronavirus outbreak - Axios 
1236803062531944448,2020-03-08 23:56:43,0,0,0,0.0,0.0,Russia will murder or poison any who gets Corona virus!
1236803062121054208,2020-03-08 23:56:43,3,0,1,-0.0167,0.4167,"post changed their headline--from the 'suspected corona virus' to omitting that part--but it's not showing up in social media previews. their police sources are full of shit, per usual."
1236803060132761600,2020-03-08 23:56:42,3,0,0,0.1667,0.1667,"Here #coronavirus will present an interesting challenge. Tourists choose to stay home -->  bookings plummet --> investors still have expenses and mortgages to repay, but no income --> back to long-term rental! #tourism #tourismresearch #socialsciencematters #sharingeconomy"
1236803057977044996,2020-03-08 23:56:42,0,0,0,0.0,0.0,"#CoronaVirusUpdate
'Trump Is Withholding #Coronavirus Testing Kits From Governors'    

  #CoronavirusUSA #maga #TheVillages #FL        #Florida"
1236803057926766592,2020-03-08 23:56:42,1,0,0,0.0,0.0,Bunker music tonight. Thinking about us all in this historic fight together. #COVID19 
1236803057846849537,2020-03-08 23:56:42,3,0,0,0.0,0.0,I wanna mute the words coronavirus and covid-19 because I have anxiety but I also feel like that irresponsible? Idk.
1236803056982990848,2020-03-08 23:56:42,0,0,0,0.0,0.1,Mutation pattern in coronavirus sequence reveals it has been silently SPREADING in the USA for weeks –  
1236803055674363911,2020-03-08 23:56:41,0,0,0,0.5,0.5,"""You have a greater chance of being murdered by the Zodiac killer than dying from coronavirus."""
1236803053942161410,2020-03-08 23:56:41,3,0,1,0.0,0.0667,"#SARSCoV2 can spread asymptotically. If you wait until #COVID19 symptoms show up, the virus has already infected others you have been contact with in the last couple of weeks."
1236803052964925441,2020-03-08 23:56:41,0,0,1,0.7,0.6,"8/ #cruise #coronavirus 
Good news about #COVID19 from  ?pic.twitter.com/KmyWFuClaf"
1236803051970875392,2020-03-08 23:56:40,1,0,0,0.25,0.3333,“First coronavirus in Shelby County” y’all some sheep
1236803050590875649,2020-03-08 23:56:40,1,0,0,-0.0773,0.4667,"Media, new:  (R-TX) says ""he will be self-quarantining at home in Texas after learning that he had a 'brief conversation and a handshake' with someone at  who later tested positive for the #coronavirus.""   /YiMfMBcTSu"
1236803050536402945,2020-03-08 23:56:40,3,3,1,0.0,0.0,Third University of Colorado Boulder employee tested for coronavirus 
1236803050045689856,2020-03-08 23:56:40,0,0,0,-0.3411,0.7854,This is  FALSE!  Not anyone who needs a test is getting one.  Hardly anyone in US is being tested unless they meet strict eligibility parameters!  It’s absurd & will likely cause a Pandemic. #coronavirus #TrumpVirus
1236803048061763587,2020-03-08 23:56:40,24,0,7,0.0,0.0,there’s 80+ cases of corona virus IN MY COUNTY LMAOO
1236803047642124289,2020-03-08 23:56:39,1,0,0,0.0,0.0,“Corona Virus? But I was suppose to go to Coachella this year” - Everyone
1236803047617171457,2020-03-08 23:56:39,11,9,1,0.0208,0.3542,No response is needed from   and the other main Parties      should carry out their civic duty and form a National Government for the duration of the #COVID19 crisis 
1236803047210266624,2020-03-08 23:56:39,0,0,0,0.0,0.5,Now someone tell this genius that his phone and computer have coronavirus so we can be spared any further interactions with him at all.  
1236803046425976837,2020-03-08 23:56:39,0,0,0,0.0,0.1,Coronavirus does not kill human also companies how GOPers think thet are people too. 
1236803045171908609,2020-03-08 23:56:39,1,0,0,0.0,0.0,Why are you blaming trump? Under Obama there was a Coronavirus cure 2016 didn’t get funded #obamavirus
1236803044257550337,2020-03-08 23:56:39,30,16,4,0.3,0.9097,"2 great hours of tv tonight:  What’s Eating America at 9 on the insidious practice of making sure some votes don’t even get cast, and  Outbreak at 10, on the front lines of the war against coronavirus. Important and scary "
1236803043703820288,2020-03-08 23:56:38,0,1,0,0.0682,0.3523," 1 new death in the UK: a man in his 60s with existing conditions and who had recently traveled to Italy

#coronavirus #COVID19 #CoronaVirusUpdate"
1236803040687951873,2020-03-08 23:56:38,0,0,0,0.3,0.45,"I completely agree on the hoarding but people need to stop saying hand sanitizers don’t kill this virus. 60%+ alcohol ones, which is most of them, do kill coronavirus."
1236803040595906561,2020-03-08 23:56:38,20,3,3,-0.1667,0.0667,"Does everyone realize how fukd we are in less than 2 months? You think your kids will be in school? No. You  think you’ll be at work? No. You thk the unprepared folks won’t go hungry, and eventually come after you? Yes. #StockMarket #stockmarketcrash #COVID19"
1236803039014633479,2020-03-08 23:56:37,0,0,0,0.0,0.0, have a chat with  about restricting flights to prevent the spread of #COVID19 
1236803038641369090,2020-03-08 23:56:37,0,0,0,0.0,0.0,"WE, the PEOPLE, COMMEND THE NYTIMES FOR THEIR COURAGE TO TELL THE TRUTH!  WE, the PEOPLE, CONDEMN TRUMP FOR HIS NON- STOP LIES, PARTICULARY ON THIS LIFE & DEATH CORONAVIRUS PANDEMIC, & HIS NOW IRREPARABLE STAIN ON THE HONOR OF AMERICA & ALL OUR FALLEN HEROES! #FUBAR #Veterans"
1236803037722624000,2020-03-08 23:56:37,3,0,0,-0.3917,0.6442,"I just bought a ton of Zicam. Zinc tabs are proven to lessen symptoms in regular Coronavirus, the common cold. So why not?
Also bought surgical gloves for shopping and neck gators for my face since surgical masks are an impossible find."
1236803036623724546,2020-03-08 23:56:37,0,0,0,0.2333,0.4302,"That is a simple idea that even a child can think of. Is it doing good?

>Italy has been conducting extensive testing for coronavirus, including  testing people who do not exhibit any symptoms of covid-19

"
1236803036384763904,2020-03-08 23:56:37,0,0,0,0.25,0.5,"Slightly higher risk of getting Coronavirus if you got the flu vaccine... it is called virus interference.

"
1236803035944218624,2020-03-08 23:56:37,0,0,0,0.05,0.5,"As the #COVID19 registered its presence in the city with a patient being quarantined and provided treatment at Rajiv Gandhi Government General Hospital, the Corporation officials have requested the hotel owners to restrain from conducting events 
"
1236803035751481344,2020-03-08 23:56:37,0,0,0,-0.125,0.375,"What are the ages of those who died in the USA due to CoronaVirus Did they have other health issues, compromised system, when they contracted the virus 

In the meantime  pic.twitter.com/bSoUB7qJQi"
1236803035478679554,2020-03-08 23:56:37,1,0,0,0.0,0.0,Tell them you have coronavirus
1236803033968902149,2020-03-08 23:56:36,2,0,0,0.2,0.9,"also to everyone saying that we should avoid handshakes because of coronavirus, I would challenge you to attend any gathering of NYC natives where a cheek kiss is an absolute given and refusing to do so is not even a viable option"
1236803031842328586,2020-03-08 23:56:36,0,0,0,0.0,0.0,State of emergency declared to address coronavirus 
1236803031515172866,2020-03-08 23:56:36,9,0,0,0.4,0.9,"just facetimed with my mom, we got into a huge argument bc of coronavirus "
1236803030626062337,2020-03-08 23:56:35,0,0,0,0.0,0.0,#Quarantine Ted Cruz please. #coronavirus #COVID19
1236803030558953472,2020-03-08 23:56:35,0,0,0,0.0,0.0,"Brent, WTI futures CRASH 20% over Saudi Arabia-Russia oil price war fears & coronavirus concerns — RT Business News "
1236803026737942530,2020-03-08 23:56:34,0,0,0,0.0,0.0,VIDEO: Bernie Sanders asked if he would cancel campaign rallies over coronavirus concerns 
