tweet_id,timestamp_1,likes,retweets,replies,polarity,subjectivity,clean_text
1236802555814043650,2020-03-08 23:54:42,0,0,0,0.0,0.0,"Whilst I appreciate the efforts being made by the #Italian government to contain and delay the spread of #SARSCoV2 (#COVID19 aka #WuhanCoronavirus) in #Lombardy, I don't see it as a solution if you can still enter or leave via an airplane or train! How is that a #Quarantine?"
1236802555100958720,2020-03-08 23:54:42,8,0,0,0.0,0.0,You'll NEVER see it in Ohio. Coronavirus scared to come here. We'll kick its ass. 
1236802554916470787,2020-03-08 23:54:42,0,0,0,-0.0267,0.54,"I reckon that the government aren't telling us the complete truth, obviously this coronavirus makes you shit yourself to death, can be the only reason for toilet roll sales."
1236802553985277952,2020-03-08 23:54:42,2,0,0,0.0,0.0,"That's how it works. When it comes to charging others, the Coronavirus is doomsday incarnate. But when it comes to having to pay/buy stuff or tests, ""Nah, it's weaker than h1n1..."""
1236802553687334912,2020-03-08 23:54:42,0,0,0,0.0,0.0,MAKE THIS VIRAL! Stop #CORONAVIRUS by washing hands correctly!  via  #CoronavirusOutbreak #2019nCoV #handwashing
1236802553452662784,2020-03-08 23:54:42,2,4,0,0.0,0.0,"To defeat coronavirus, put politics aside and respect President Trump’s leadership | Opinion  via "
1236802553339396097,2020-03-08 23:54:42,2,0,1,-0.4,0.6,"I think the Coronavirus needs to quarantine itself from coming into contact with Ted Cruz.  Poor virus...(yes, sarcasm...well, sort of...)"
1236802553091969025,2020-03-08 23:54:41,1,0,0,-0.1,0.1,NY AG hits Jim Bakker with cease-and-desist order over alleged coronavirus cure - ABC News  (via )
1236802552316014594,2020-03-08 23:54:41,0,0,0,0.4875,0.5375,"Repeating your lies does nothing to lift up Americans, nor does it make things true. Make #COVID testing more available before you kill us all.  A tennis pavilion is how Melania spends our money? You just don’t know how to be a good person. #COVID19 #InternationalWomensDay2020"
1236802552286543878,2020-03-08 23:54:41,0,0,0,0.0,0.0,Coronavirus in N.Y.: Cuomo Attacks C.D.C. Over Delays in Testing 
1236802551540002817,2020-03-08 23:54:41,0,0,0,0.0,0.0,"#CoronaVirusUpdate
'Trump Is Withholding #Coronavirus Testing Kits From Governors'    

  #COVIDー19 #Philly  #topprog #Americafirst  #Williamsport
#Pittsburgh  #Gettysburg   "
1236802550906716160,2020-03-08 23:54:41,0,0,0,0.0,0.0,Coronavirus Market Turmoil - What Else Can The FED Do? - McAlvany Weekly Commentary 
1236802548742283264,2020-03-08 23:54:40,0,0,0,0.0,0.0,"Yahoo News: U.S. stock futures tumble 4% on coronavirus fears in pre-market trade.


via "
1236802548352217088,2020-03-08 23:54:40,2,1,2,0.2,0.2,sorthear was really searching up flights this morning talkin bout  “Idgaf if I catch the corona virus a ROUNDTRIP to Hawaii is $325” pic.twitter.com/M5rWjtrx1S
1236802544627847168,2020-03-08 23:54:39,3,0,0,0.0,0.0,Northwell receives federal approval to test for coronavirus  via 
1236802544556539904,2020-03-08 23:54:39,3,0,1,0.0,0.0,Come at me #coronavirus I DARE you pic.twitter.com/VGWXdHPF5S
1236802542505463809,2020-03-08 23:54:39,0,0,0,0.1932,0.4167,Coronavirus updates live: Millions quarantined in Italy as D.C reports first case 
1236802540223598592,2020-03-08 23:54:38,0,0,0,0.1364,0.5,Coronavirus live updates: Ted Cruz shook hands with CPAC patient; State Department warns against cruise travel 
1236802539305066496,2020-03-08 23:54:38,0,0,1,-0.0667,0.1667,"A question: If COVID-19/Coronavirus cases continue to ramp up (almost 110K cases) across 104 countries and territories, what happens to the supply chains, logistics, manufacturing and retail (and related jobs) over the next few months?"
1236802538483187715,2020-03-08 23:54:38,19,0,0,0.24,0.6,Fuck I gotta travel soon honestly dying of coronavirus would be worth it to fly on one of these empty planes I've been hearing about.
1236802538168434688,2020-03-08 23:54:38,1,0,0,0.1667,0.3167,".#Italy has overtaken South Korea to become the most affected country outside China as the number of coronavirus infections in the country soared to 7,375 March 8, according to its health regulator. Currently, Italy has taken strict measures to fight the epidemic. pic.twitter.com/i19wPFKkka"
1236802537912709125,2020-03-08 23:54:38,0,0,0,0.0,1.0,Fauci on shuttingdown #coronavirus #epicenters: 'Anything's possible'
1236802536465731585,2020-03-08 23:54:38,0,0,0,0.2,0.2,So much education is needed -  thank you Janice for sharing.  #coronavirus #Coronavid19
1236802536201424896,2020-03-08 23:54:37,0,0,0,0.0,0.0,prolly the corona virus bro 
1236802533814747136,2020-03-08 23:54:37,3,0,5,0.1607,0.6357,Wow. Really concerned at the mixed messaging I’m getting in trying to be a “good citizen” re possibility of sickness. Just got told to go to the hospital emergency when I’m exhibiting symptoms of #COVID19 - wtaf? Probs most likely some weird arse flu but trying to do the right
1236802533609349126,2020-03-08 23:54:37,0,1,0,0.1778,0.2722,"#COVID19 Pandemic
Organize Health System worldwide. Tipping point stopping workers, students, religious ... all social closer interactions MUST be considered each country seriously or more DEATHS worldwide."
1236802533101690880,2020-03-08 23:54:37,5,0,1,0.0,0.0,"Kim appears to have #coronavirus under control, unlike Trump."
1236802532443410434,2020-03-08 23:54:37,1,0,1,0.0,0.0,Death toll 366 in Italy from the Coronavirus.
1236802530794971136,2020-03-08 23:54:36,8,0,0,0.7,0.6,Even #coronavirus cannot stop a good #crawfish festival #crawfete #leftovers #louisiana  pic.twitter.com/rp5NRU2w6o – at Perkins Rowe Square
1236802530463662080,2020-03-08 23:54:36,0,0,0,0.0,0.0,"Say it with me;
#Alcatraz.             #virus
""Ben Carson says he doesn't want to preview plan to handle cruise ship's coronavirus cases""  "
1236802530430115842,2020-03-08 23:54:36,7,1,2,-0.6,0.9,"• Hospital not up to date on protocols
• Employees afraid to approach him
• We are not prepared for this
• Intervention needed

That's what I'm getting from this as a healthcare worker. 
#GetJamesTheMeds #HelpJames
#coronavirus #COVID19
"
1236802529792528385,2020-03-08 23:54:36,3,0,0,-0.4,0.6,"#Coronavirus Approximately 500 #athletes who participated in the #SpecialOlympics Event in #Fremont are being asked to #selfquarantine.

#COVID19 #CoronavirusExposure #FremontYMCApic.twitter.com/RunIyH4r65"
1236802528014106624,2020-03-08 23:54:36,2,0,0,-0.0867,0.6303,"With new reports on possible transmission of #COVID2019 by currency, I question whether this is another example of why we need to seriously move forward #bitcoin #cryptocurrency for the average person."
1236802521672429569,2020-03-08 23:54:34,1,0,1,0.15,0.475, #AskSkyNews Why is the government allowing travel to and from Corona Virus hot-spots only for them to return and spread it in the UK? So many of the cases we hear about are directly linked to international travel.
1236802520724324352,2020-03-08 23:54:34,0,0,0,0.35,0.825,Corona virus total reported case list by country wise. Source: bno news. #coronavirusinindia #CoronaVirusUpdate #coronavirus #caronavirusoutbreak #2019nCoVpic.twitter.com/QKrknjH8P9
1236802519839506433,2020-03-08 23:54:34,1,1,0,0.0136,0.4727,Quinn Emanuel Partner Tests Positive With Coronavirus in NY; Firm To Keep Workers Home  via 
1236802519688531968,2020-03-08 23:54:34,0,0,0,0.5,0.5,"He’s a trump talking head. That’s all. 
He, like trump, doesn’t care about the Coronavirus and how many people die."
1236802519621201921,2020-03-08 23:54:34,1,0,1,-0.25,0.5, have been trying to reach you guys to see what can be done about tickets I bought. Called your customer care rep-Very unhelpful phone conversation that went around in circles Given #COVID19 it’s not safe to travel. Can you help and provide guidance
1236802519218692099,2020-03-08 23:54:33,0,0,0,-0.6667,1.0,"U r ridiculous & mentality disturbed. There r people in this country who believe that the Coronavirus doesn’t exist, know 1 has died in USA & that it’s all fake news because of u! Try & do your job 4 once!!!"
1236802518027587584,2020-03-08 23:54:33,8,4,1,0.3,0.5,"Doesn't matter what he meant, the idjit posted an image of Trump fiddling while #coronavirus runs wild. And #coronavirus doesn't care if you love DT or not. 

So keep laughing."
1236802515309649922,2020-03-08 23:54:32,0,0,0,0.0,0.0,ted cruz get coronavirus challenge 
1236802513526853632,2020-03-08 23:54:32,2,0,0,0.1817,0.4283,"Despite studying in a Medical Institution. It seems that the Coronavirus confirmation isn't enough.. Will we wait until hard quarantine and millions of people affected?
Good luck feeling safe."
1236802510788210688,2020-03-08 23:54:31,1,1,0,0.0,0.0,"Sen. Ted Cruz chooses voluntary isolation after exposure to coronavirus-positive person

"
1236802510012243969,2020-03-08 23:54:31,0,0,0,0.1333,0.6333,"? “ The 2019 Wuhan outbreak is caused by the bacteria Prevotella, which is aided by the coronavirus, possibly to adhere to epithelial cells - Prevotella is present in huge amounts in patients from both China and Hong Kong”  "
1236802507268972544,2020-03-08 23:54:31,0,0,0,-0.0306,0.5722,"No toilet paper at Costco in Lethbridge, Ab.  Please stop hoarding it.  Luckily I have enough but, this is ridiculous.  Also, only a few packs of paper towel.  #ToiletPaperApocalypse #COVID19"
1236802506451234817,2020-03-08 23:54:30,0,0,0,0.2,0.2,Thanks #ChinaCoronaVirus #china #COVID19 bravo  smh
1236802505704521728,2020-03-08 23:54:30,0,0,1,0.2,0.55,"Nope. Trump didn't ever say the #coronavirus was a hoax.  He said the Democrats who are politicizing the virus are the hoax because of their criticism of Trump,  as if trump is responsible for the outbreak."
1236802505557905409,2020-03-08 23:54:30,0,0,0,-0.05,0.6792,Isn't this lovely. The state that can't get its shit together finally has cases of coronavirus that are concerning. Again CT GET YOUR SHIT TOGETHER.what the fuck has happened to Connecticut.This state is NOT the same I grew up in. ⁦⁩
1236802505054588933,2020-03-08 23:54:30,0,0,0,0.0,0.0,".: no workers should be left out of pocket for self-isolating to avoid spreading Coronavirus. If you agree, add your name to this petition:  "
1236802504198950912,2020-03-08 23:54:30,0,3,0,0.25,0.5,"As Coronavirus Deaths in Italy Surpass 100, Pontifical Universities Close . . .The Latest Link via Big Pulpit #When%3A2020-03-4+21%3A16%3A01 … #bigpulpit 1 #feedly"
1236802503888560138,2020-03-08 23:54:30,0,0,0,-0.7143,0.8571,"Health officials shift tone on coronavirus, say elderly and sick at risk "
1236802503393464327,2020-03-08 23:54:30,181,101,2,0.18,0.69,amazing detail showing how slow America has been in catching up to the coronavirus threat: gene detectives have found a bit of evidence suggesting that part of California’s outbreak comes from the Washington state outbreak that officials only recently discovered 
1236802503372492800,2020-03-08 23:54:30,1,0,1,0.0,0.0,Austin hipsters talking about how SARS was way cooler than corona virus
1236802503330664448,2020-03-08 23:54:30,11,0,0,0.0,0.0,whoever owns this tub is immune to the coronavirus 
1236802502672011264,2020-03-08 23:54:29,1,0,1,-0.4,0.6,"Agreed! We need to lobby our statewide “leaders” to stop them. But if the Coronavirus becomes worse, people will have to stay home from work they could implement this"
1236802502584160256,2020-03-08 23:54:29,87,54,2,0.225,0.65,"The avid news watchers, they’re the real authorities on the coronavirus."
1236802500843507713,2020-03-08 23:54:29,3,0,0,0.1722,0.5889,"I ain't giving up, for sure. I was in the ER here in Charlottesville when the Nazis attacked. I know the score. & working in the ER, esp staring down what's coming for us with the Corona virus- we need Medicare for All, we need structural change. But I'll vote for Bernie or Joe."
1236802500772102144,2020-03-08 23:54:29,0,0,0,-0.35,0.55,"You lie or your doctor ilied.

Asymptomatic #covid19 transmission is common, incubation can take 21 days in some individuals, while they are infectious. 

conservatives are poor hand washers. 

Basically you're typhoid mary & need to be quarantined"
1236802499291602946,2020-03-08 23:54:29,1,0,1,0.0,0.0,"Tri not 2 lve yoru hous often, dnt kiz othur pl nd use hn snitisur nd sum hao, tri 2 enjoi yoru vacashun
#kfupm #coronavirus"
1236802496758083585,2020-03-08 23:54:28,0,0,0,-0.0625,0.75,"BECAUSE OF #Covid19, #CoronavirusOutbreak how Extreme will the Downward Plunge of the #GlobalEconomy & #GlobalCommerce be?
Perhaps, NOW is the time to Release #ZeroPointEnergy Tech with its #AbundanceForAll & #PeaceThroughAbundance; this would definitely END #EconomicWW3.
#Peace"
1236802495772364802,2020-03-08 23:54:28,0,0,0,0.5,0.6,"Love in the Time of Coronavirus
 from "
1236802495764000768,2020-03-08 23:54:28,2,0,0,-0.1,0.85,"Lol I don't need the coronavirus to encourage me to continue boycotting cruises since I found out how polluting, irresponsible, disrespectful and disgusting they are #SaveOurOceans #SaveOurWildlife #RespectOurSeaLife #ScubaDiving #Pollution #OnlyTrashyPeopleLitter #ECO"
1236802494530977792,2020-03-08 23:54:28,0,0,0,0.0,0.75,Coronavirus Researcher Calls It The 'Most Frightening Disease I've Ever Encountered' | 
1236802494367444995,2020-03-08 23:54:27,0,0,0,-0.1,0.1,"The Atlantic: What Could Happen if the Coronavirus Closed Schools for Days, Weeks, or Even Months.


via "
1236802494036152321,2020-03-08 23:54:27,0,0,0,0.2,0.2,"You really should read this.
“Coronavirus, Face Masks and Hand Sanitizers — A Story of Supply and Demand in Nigeria.” by Tam Alex "
1236802493956456448,2020-03-08 23:54:27,0,0,0,0.25,0.5,"I saw this on the Sun app and thought you'd be interested

Joey Essex wears face mask and gloves in supermarket amid coronavirus outbreak

"
1236802493633495041,2020-03-08 23:54:27,0,0,1,0.0,0.0,Coronavirus was created there in a bando. Don’t let the stats lie to you
1236802493268422656,2020-03-08 23:54:27,1,0,0,0.0,0.0,How to boost your immune system to avoid colds and coronavirus 
1236802492396011524,2020-03-08 23:54:27,1,0,0,-0.15,0.2,"Fitch says coronavirus increases risk of deterioration in Australia, NZ bank asset quality
The ratings agency says has a negative sector outlook for Australian banking system"
1236802492240818176,2020-03-08 23:54:27,5,1,0,-0.15,0.4,Ain’t nobody give a fuck about the coronavirus old town is still lit and packed 
1236802492018626560,2020-03-08 23:54:27,0,0,0,0.3427,0.5608,There are many strains of Coronavirus and they have all been killed by colloidal silver something everybody can buy or make your own it's very cheap Pennies on the dollar and most believe that this new strain also dies in the presence of colloidal silver no fear porn here... 
1236802490936332292,2020-03-08 23:54:27,3,0,0,-0.05,0.7,Look at this as more dangerous then Corona Virus
1236802490185797637,2020-03-08 23:54:26,0,1,0,0.0,0.0,"8 Mar 20, 7pm GMT+2
#COVID19 cases in the Region 
Afghanistan 4
Bahrain 79
Egypt 49 incl 1 death 
IR Iran 6566 incl 194 deaths
Iraq 61 incl 4 deaths 
Jordan 1
Kuwait 64
Lebanon 33
Morocco 2
Oman 16
OPT 19
Pakistan 6
Qatar 15
KSA 11
Tunisia 1
UAE 45"
1236802490038960128,2020-03-08 23:54:26,0,0,0,0.0,0.0,That feeling when you're locked in your house stockpiling canned goods because your parents are panicking over the #coronavirus
1236802488277368838,2020-03-08 23:54:26,0,0,0,0.2,0.2,Thanks #COVID19
1236802487119753218,2020-03-08 23:54:26,0,0,0,0.0,0.0,Will the Coronavirus Be the Grisly End to a 28-Year Run? 
1236802486767423488,2020-03-08 23:54:26,0,0,0,0.5,0.5,Top coronavirus expert warns Americans to brace for quarantines  via 
1236802486582816769,2020-03-08 23:54:26,0,0,0,0.1,0.45,Better than having Coronavirus at least 
1236802486306050048,2020-03-08 23:54:26,0,0,0,-0.0493,0.1472,"**Helpful Tip**
If you came up short on the #COVID19 toilet tissue frenzy, don’t despair! 
Just head on down to your local beach to collect seashells and practice the #ThreeSeashells system.
You’re welcome!pic.twitter.com/eAzEtvn4Fg"
1236802485999845376,2020-03-08 23:54:25,1,0,0,0.25,0.5,Corona virus  has a 2-3.4 % mortality rate  you have a higher chance of dying in a car accident or having heart disease
1236802485119000578,2020-03-08 23:54:25,0,0,1,0.0,0.0,All schools in Bratislava will close tomorrow because of the #coronavirus. Shops still fully stocked as of today.
1236802483013500928,2020-03-08 23:54:25,0,0,0,0.3636,0.5227,"Ted Cruz Goes Into Self-Quarantine After Coming In Contact With Person Who Tested Positive For Coronavirus
 READ MORE: "
1236802482648436737,2020-03-08 23:54:25,1,0,1,0.5667,0.8,"ABSOLUTELY, Altho I hope his moves don’t contain the coronavirus bc sayuri deserves better <3"
1236802482086580224,2020-03-08 23:54:25,5,0,0,0.1071,0.2476,"#Germany promised aid to companies hit by demand collapsing as a result of the #coronavirus epidemic, while its health minister urged a halt to large public events in the hope of reducing the burden on the healthcare system.
"
1236802480937283584,2020-03-08 23:54:24,1,0,0,-0.35,0.7,"So if Trumps Base denies the Coronavirus truth, is that called "" Natural Selection?"""
1236802480597602304,2020-03-08 23:54:24,3,3,0,0.3636,0.5227,"Ted Cruz Goes Into Self-Quarantine After Coming In Contact With Person Who Tested Positive For Coronavirus
READ MORE: "
1236802479536267264,2020-03-08 23:54:24,0,0,0,0.0333,0.45,Toilet paper panic goes international. It's spreading faster & becoming more dangerous than coronavirus. O Canada! What are you doing? You seem to have caught the loo roll disease from Australia. #.cbj37 … via 
1236802477652992000,2020-03-08 23:54:24,5,2,0,-0.4944,0.5556,"If people think #coronavirus is bad 4 bringing on shortages of toilet paper,  bottled water, and cold medicines,  just imagine what would happen if socialism took over! Gov. take over of buisness,  trade, distribution of goods. Reminds me of Tragedy of The Commons"
1236802476658946048,2020-03-08 23:54:23,0,0,0,0.5,0.5,"If the coronavirus is around for nine months or more, it will incorporate the election. 
just let the ramifications of that sink in. Turnout? Opportunistic voter suppression? Postponement? "
1236802475144794112,2020-03-08 23:54:23,1,0,1,0.1963,0.5542,"All my friends and family live in those areas in the north of Italy that have been quarantined, due to the #COVID19 emergency. I have never missed them as much as I do now. This is an unprecedented emergency. #Italy is a great, resilient country that has overcome dramatic"
1236802474549358595,2020-03-08 23:54:23,0,0,0,0.0,0.95,Yea I think so lmao. Faking coronavirus for a room. Shits crazy in these Twitter streets.
1236802471781163008,2020-03-08 23:54:22,2,0,1,0.0,0.625,Breaking: Entire Lakers team gets coronavirus 
1236802471231717376,2020-03-08 23:54:22,0,0,0,0.0527,0.5812," 
Sure, just like Walking Dead right? 

Wash your hands. Don't touch your face.

""The coronavirus panic is dumb"" Elon Musk 03/06/2020"
1236802470271205377,2020-03-08 23:54:22,4,1,0,0.45,0.75, if you have elderly friends & relatives please think about showing them this video & talking 2handwash - many will have missed this important info #coronavirusuk BBC News - Coronavirus: Watch how germs spread 
1236802468186664961,2020-03-08 23:54:21,3,2,0,0.0,0.5,: we’re in Oliver Twist markets.. as 10-year yield slips below 0.50% on #coronavirus fears.  Watch and follow  for the market open in Asia tonight as US futures point to a 3.8% opening drop at this hour.pic.twitter.com/zdhjGGLuxS
1236802468073410560,2020-03-08 23:54:21,0,0,0,0.1,0.1833,"The real reason Bernie won't bite into Warren or toss out aoc is cuz the last time a cracka handled snakes like that, we done got this coronavirus shizz"
1236802466412244994,2020-03-08 23:54:21,0,1,0,-0.1875,0.75,Now what? After corona virus took a part of our nation and around the globe.. here we go again. This must be worst than COVID virus. Oh my Goodness a Top Obama Officials INDICTED On 16 Counts Of Theft And Fraud. God knows  what's going  to happen. Oh GOD! 
1236802464956829697,2020-03-08 23:54:20,0,0,0,0.0,0.0,Iowa confirms 3 cases of coronavirus 
1236802464785014791,2020-03-08 23:54:20,1,0,1,0.225,0.275,"It’s okay guys.  We know you are both manly men but in a bromance. 

You don’t need an excuse like Corona Virus to hang out.

Your wives understand. 

They need time away too."
1236802463937843205,2020-03-08 23:54:20,27,16,4,0.1364,0.4545,New message from  on the #coronavirus tracking. pic.twitter.com/ynIhhNm34F
1236802463690342405,2020-03-08 23:54:20,0,0,0,-0.375,0.6,"Well duh! #coronavirus
#COVID19 #PuertoRico #SundayThoughts
"
1236802463333847040,2020-03-08 23:54:20,1,0,0,0.0,0.0,This was before #Coronavirus  
1236802461794353153,2020-03-08 23:54:20,0,0,0,0.0682,0.25,"Coronavirus Live Updates: Cases in U.S. Cross 500, Deaths in Italy Surge #Coronavirus "
1236802460552794118,2020-03-08 23:54:19,1,0,0,0.0167,0.4917,"I intensely follow politics and am seriously concerned for the #Coronavirus (it‘s for real and about to explode), but living in the middle of nowhere my number one concern is how to stop spiders and centipedes from getting into my room and saying hello when I’m in bed."
1236802460536188928,2020-03-08 23:54:19,0,0,0,0.2375,0.5125,Trump Flatly Admits He’d Leave Americans Stranded to Hold Coronavirus Numbers Static  via 
1236802459726688256,2020-03-08 23:54:19,3,0,1,0.0,0.0,"I need to wear a sign when I got out.  ""It's just allergies...not Coronavirus"". Getting some scared ass looks when I cough or sneeze.  #allergies #damnpollen"
1236802459235950593,2020-03-08 23:54:19,0,0,0,0.0,0.0,Sharing thread. #COVID19 #coronavirus 
1236802459143716865,2020-03-08 23:54:19,22,11,20,0.0,0.6,"There do appear to be different trajectories - why?

#covid19 pic.twitter.com/A5yqcvjjnn"
1236802458443288577,2020-03-08 23:54:19,0,0,0,0.0,0.0,Buckets of coronavirus
1236802458191564811,2020-03-08 23:54:19,7,0,0,0.0,0.0,If you’ve ever been to a concert at stage ae you’re immune to the corona virus
1236802457532948480,2020-03-08 23:54:19,10,3,2,0.525,0.8306,"This handy #covid19 chart comes from a NextDoor post without attribution. I wish I knew who made it or how accurate it is, but it sure seems handy: pic.twitter.com/VjAkTsoxv8"
1236802455012356096,2020-03-08 23:54:18,0,0,0,0.0,0.0,Trump Is Withholding Coronavirus Testing Kits From Governors 
1236802454810836993,2020-03-08 23:54:18,0,0,0,0.15,0.3625,Trump defender buried by entire Jake Tapper CNN panel for trying to laugh off president’s coronavirus lies #.XmWFp9bLPuM.twitter …
1236802454068420611,2020-03-08 23:54:18,0,0,0,0.0,0.0,"State Department: Amid coronavirus risk, Americans 'should not travel by cruise ship' - Fox News

State Department: Amid coronavirus risk, Americans 'should not travel by cruise ship'  Fox NewsGrand Princess cruise ship to offl…


#NEWS
#GOOGLENEWSpic.twitter.com/AUalr2wzpf"
1236802453800210435,2020-03-08 23:54:18,0,1,1,-0.2381,0.319,"Actually I would like him to tell the American citizens the truth about this coronavirus.
If I get it I will be bringing it work bc I can't afford to miss work, I don't have the luxury of sick time."
1236802453791592448,2020-03-08 23:54:18,1,0,0,0.2,0.4,By September we won’t have JT as Prime Minister anymore. The crashing economy along with the devastation of the coronavirus will drive him straight out of office. #cdnpoli
1236802453221388288,2020-03-08 23:54:18,12,0,1,0.1125,0.3625,"This weekend we attended a 5-years bday party with 20+ kids and many adults, a basketball game with a full ass gym, a packed church service. At no time was anyone worried about the coronavirus.  I bet 95% of Americans have not altered their daily lives.  Can the media chill out?"
1236802453183455232,2020-03-08 23:54:18,0,0,1,0.045,0.63,"I voted for Trump in 2008. I'm impressed with the economy, but I'm very frustrated with the coronavirus response from Trump. People are panicking on Wall Street, probably because Trump is contradicting everything the experts are saying. Why? Help me understand."
1236802452478967812,2020-03-08 23:54:18,9,0,1,0.0,0.0,If you ever drank this you’re immune to the coronavirus pic.twitter.com/kcPRhiNrNZ
1236802452072120321,2020-03-08 23:54:17,5,0,2,-0.1625,0.6208,"The summit I was meant to speak at tomorrow has been postponed until May because of a few confirmed cases of coronavirus in that area.

On one hand, I'm relieved I don't have to give a speech tomorrow. On the other hand, I'm disappointed.  I was actually ready.

Brains are weird."
1236802450457276416,2020-03-08 23:54:17,1,0,1,0.0148,0.6185,"Yeah, it’s incredible to see officials at this day and age going the Jaws/Chernobyl route. 

Like we all know this villainous archetype & plot from a million disaster movies.

How do they not know that they’ll go down in history as the bad guys when Coronavirus the film is made??"
1236802448716488705,2020-03-08 23:54:17,6,0,0,0.0,0.0,May be a medicine to avoid Coronavirus
1236802448523591680,2020-03-08 23:54:17,10,3,1,-0.1125,0.2375,BREAKING: A school in Sydney’s northern suburbs has closed due to coronavirus fears. #7NEWS
1236802446716030976,2020-03-08 23:54:16,43,33,3,-0.7,1.0,Coronavirus and OPEC-vs.-Russia oil price war could take crude into the $20s: Goldman Sachs 
1236802446309109762,2020-03-08 23:54:16,0,0,0,0.1667,0.6667,"I was also born with the ability to look over the next hill, and the key here is with an unbiased eye. coronavirus is not going to magically go away. and wait till you see the death rate in Florida 2 months from now. it's called heaven's waiting room for a reason. "
1236802445893931009,2020-03-08 23:54:16,0,0,0,0.0,0.0,Coronavirus is exposing Trump's unsuitability to handle a crisis  
1236802445818433537,2020-03-08 23:54:16,2,0,0,0.0,0.0769,I will be self quarantining today as part of my regular life #COVID19
